Recipe_name;Diet_type;Cuisine_type;Protein(g);Carbs(g);Fat(g);Calories
Garlic Oregano Olive Tapenade Recipe [Paleo. AIP. Keto];keto;mediterranean;50.64;21.61;63.52;860.68
Mushroom. Spinach and Bacon Egg Muffins (Paleo. Whole30 + Keto);keto;american;106.32;58.7;215.74;2601.74
Keto Instant Pot or Slow Cooker Chili Queso Dip;keto;american;42.21;8.19;84.89;965.61
Keto Lemon Cake With Blueberries {Low-Carb. Gluten-Free};keto;american;59.87;46.37;100.58;1330.18
Keto Low Carb Pot Roast Slow Cooker Recipe;keto;american;398.82;45.74;127.03;2921.51
Slow Cooker Zuppa Toscana (low carb. keto friendly);keto;italian;151.15;101.29;398.5;4596.26
Low Carb Hamburger Soup Recipe (Whole30. Keto. Paleo);keto;american;173.6;73.82;208.8;2868.88
Keto Low Carb Pizza Casserole Recipe (Easy) - 5 Ingredients;keto;italian;147.72;89.22;188.27;2642.19
No Churn Mint Chip Ice Cream | Keto. Sugar Free;keto;american;12.69;171.37;212.24;2646.4
Orange and Five-Spice Roasted Chicken Legs | Keto. Paleo;keto;mediterranean;677.22;41.71;686.9;9057.82
Cream Cheese Spinach Stuffed Chicken (Low-carb. Keto);keto;american;112.64;15.78;98.81;1402.97
Easy Crockpot Chicken Stew (Low Carb. Keto) recipes;keto;american;149.85;46;182.67;2427.43
Chocolate Coconut Coffee Creamer {Paleo. Dairy-Free. Keto. Vegan};keto;american;2.21;14.72;28.6;325.12
Broccoli Cheddar Soup (Keto-3.7 net carbs per serving);keto;american;116.23;192.1;347.33;4359.29
Super Sloppy Joe Stuffed Peppers (keto. low carb);keto;american;130.71;44.36;163.82;2174.66
Easy Keto Low Carb Meatballs Recipe - Italian Style;keto;italian;104.51;28.37;114.97;1566.25
Taco Salad - Low Carb. Keto. Gluten-Free recipes;keto;mexican;57.77;33.73;80.7;1092.3
Low Carb Keto Sausage Balls Recipe With Cream Cheese;keto;american;197.31;65.09;391.43;4572.47
Chicken Skillet with Bacon Brussels Sprouts (Paleo. Whole30 + Keto);keto;italian;284.3;60.25;99.57;2274.33
Easy Keto Shrimp Scampi - Low Carb & Gluten Free;keto;south east asian;127.05;39.09;61.23;1215.63
Chicken Parmigiana (Keto/Gluten-free/Low-carb) recipes;keto;italian;248.2;64.35;171.14;2790.46
The Best Low Carb Keto Psyllium-Flax Bread recipes;keto;american;107.72;187.02;171.45;2722.01
Chicken Pot Pie Soup | Keto | Low carb recipe;keto;american;59.87;20.07;102.26;1240.1
Mini Zucchini Avocado Burgers Recipe [Paleo. Keto. AIP];keto;american;44.44;15.24;93.04;1076.08
Coconut Oil Baked Spaghetti Squash Recipe [Paleo. AIP. Keto];keto;italian;2.59;27.92;16.12;267.12
Paleo Caesar Dressing Recipe (2 Methods) [Keto. Dairy-Free];keto;american;12.28;5.99;227.86;2123.82
Low carb and Keto Chocolate Candy Kisses (Baci) recipes;keto;american;16.84;37.21;139.49;1471.61
Low Carb Keto Soy Wrapped Spicy Salmon Sushi Roll;keto;nordic;88.9;8.65;91.63;1214.87
Keto Chicken Cauliflower Casserole Recipe [Dairy-Free. Paleo];keto;italian;114.07;102.01;147.95;2195.87
Instant Pot Broccoli Cheese Soup--HUGE Batch KETO;keto;american;186.92;148.87;801.84;8559.72
Low Carb Mexican Pizza - Keto. Gluten Free recipes;keto;italian;138.46;38.44;208.23;2581.67
Baked Tuna Melt Jalapeño Poppers (Keto. Gluten-Free);keto;mexican;294.53;187.42;280.9;4455.9
Keto Pizza Cauliflower Casserole (low carb and gluten free);keto;italian;270.18;78.05;406.22;5048.9
Sara Louise's Keto Hungarian Chicken Paprikash (Instant Pot);keto;central europe;243.48;67.79;230.33;3318.05
Paleo Passion Fruit Coconut Yogurt Parfait Recipe [AIP. Keto];keto;french;1.69;507.23;3.13;2063.85
Wednesday Keto Diet Plan | Veg and Non-Vegetarian Recipes;keto;american;187.76;47.75;276.05;3426.49
Almond Butter Freezer Fudge (Keto. Vegan. Gluten-free. Paleo);keto;american;55.06;75.09;200.22;2322.58
Keto Rocket Fuel Cafe Mocha with Chia Seeds recipes;keto;american;4.5;9.77;27.72;306.56
Priya's Keto Avocado Garlic Chutney - Step by Step Recipe;keto;indian;7.46;32.94;32.35;452.75
Broccoli Kale Pizza Crust Recipe | Crispy Keto Pizza Crust;keto;italian;47.53;71.41;39.84;834.32
BLTA Stuffed Tomatoes - Low Carb. Paleo. Keto. GF recipes;keto;italian;26.2;35.95;110.12;1239.68
Sara Louise's Keto Herbed Mustard Cod With Cauliflower Rice;keto;mediterranean;126.08;15.35;51.93;1033.09
4-Ingredient THM Chocolate Coconut Candy (easy keto fat bombs!);keto;french;4.22;13.09;220.95;2057.79
Instant Pot® Keto Thai Chicken Soup (Tom Kha Gai);keto;south east asian;175.18;57.38;209.5;2815.74
Chocolate Keto Brownies (Low Carb. Sugar-free. Grain-Free);keto;french;34.4;32.72;123.11;1376.47
Dry Rubbed Ribs - Low Carb. Keto. Gluten-Free recipes;keto;american;210.22;23.49;180.76;2561.68
Coconut Curry Chicken: A Keto Low Carb Curry Recipe;keto;indian;109.96;48.36;141.36;1905.52
Keto Chicken Jalapeno Poppers Recipe [Dairy-Free. Low Carb. Paleo];keto;american;58.62;4.96;85.31;1022.11
Pumpkin Spice Vegan Keto Doughnuts (paleo. nut free) recipes;keto;american;8.88;36.52;37.88;522.52
Sheet Pan Keto Chicken Sausage with Roasted Brussels Sprouts and Tomatoes;keto;mediterranean;27.5;27.64;76.82;911.94
Ultimate Keto Fathead Cauliflower Pizza Crust in the Known Universe;keto;italian;53.33;34.03;79.24;1062.6
Creamy Avocado Zoodles with Bacon {Keto. Low Carb. Paleo} — Steemit;keto;american;22.38;35.8;75.69;913.93
Creamy Paleo Cauliflower Mash Recipe [Dairy-Free. Keto. AIP];keto;american;6.39;15.09;38.84;435.48
Dijon Chicken Drummies - Low Carb. Gluten-Free. Keto recipes;keto;french;42.48;41.15;69.99;964.43
Making Low Carb Keto Ice Cream For The First Time recipes;keto;american;14.34;22.86;120.23;1230.87
Meat Lover's Scramble Keto Egg Bake (Low Carb Friendly);keto;american;136.56;16.11;216.83;2562.15
Gluten Free. Keto Friendly. Low Carb. Buffalo Chicken Casserole;keto;american;130.95;51.54;216.56;2679
Keto Cauliflower Fried Rice Recipe. Low Calorie. Low Carb;keto;chinese;32.67;58.26;39.18;716.34
Creamy Blue Cheese Dressing – Low Carb Keto Nom! recipes;keto;american;14.56;5.83;64.8;664.76
Sara Louise's Keto Four Cheese Zucchini And Cauliflower Gratin;keto;french;194.27;92.43;382.12;4585.88
Keto Samoa Bars {THM:S. Low Carb. Ketogenic. Sugar-Free};keto;american;11.3;63.57;163;1766.48
Easy Low Carb Egg Salad and Day One Back on Keto;keto;american;32.7;3.07;46.98;565.9
Easy Fresh Salsa – Low Carb Keto | Sugar Free recipes;keto;mexican;8.54;45.23;29.4;479.68
No-Cook Refreshing Mint Avocado Chilled Soup [Paleo. Keto. AIP];keto;american;8.96;25.55;78.44;844
Zesty keto chicken broth with broccoli rice and leafy greens;keto;american;138.71;89.43;122.45;2014.61
Instant Pot® Keto Chicken Thighs in Lemon-Garlic Cream Sauce;keto;american;137.9;29.16;225.61;2698.73
Easy Keto Broccoli Slaw Recipe (Low Carb and Gluten Free);keto;american;11.34;29.01;75.19;838.11
Keto Broccoli Cheddar Muffins (Gluten-free/Low Carb) recipes;keto;italian;107.72;67.4;185.7;2371.78
Keto Strip Steak Lettuce Wraps (Low Carb. Grain Free);keto;american;180.65;51.49;165.55;2418.51
Best Keto & Paleo Tortillas. Taco Shells & Nachos recipes;keto;mexican;57.32;98.71;161.51;2077.71
Oven Roasted Garlic Parmesan Cabbage Steaks (Keto. GAPS. Low-Carb);keto;american;17.59;21.55;44.56;557.6
Interested in the keto diet? Try this noodle bowl | CBC News;keto;asian;37.81;86.64;22.39;699.31
Broccoli & Chicken Stir Fry Recipe – Low Carb. Keto & Paleo recipes;keto;chinese;104.47;48.84;99.09;1505.05
Fat Bomb Chive Cream Cheese Dip | Keto Fat Bomb Recipe;keto;american;15.82;13.9;133.7;1322.18
Fresh Chive and Bacon Fat Roasted Black Radishes (AIP/Paleo. Keto);keto;french;3.48;15.94;51.88;544.6
AIP Lime Pickled Radishes [Paleo. Keto] – An Easy Side Dish Recipe;keto;american;0.4;4.35;0.09;19.81
Low Carb Crispy Walnut Shrimp - Gluten-Free. Keto. LCHF recipes;keto;american;100.18;10.03;103.53;1372.61
Bombay Sloppy Joe on Low-Carb Buns recipes;keto;american;109.33;71.68;135.26;1941.38
Crispy Fried Onions {Gluten-Free Fried Onions} - Whole30. Paleo. Keto;keto;french;29.05;107.97;99.77;1446.01
Low-Carb Chocolate Hazelnut Spread aka Keto Nutella recipes;keto;american;67.45;177.68;352.47;4152.75
Have A Very Keto Christmas With These 4-Ingredient Chocolate Orange Fat Bombs;keto;italian;6.29;16.14;204.76;1932.56
Easy Baked Jicama Fries | Low-Carb. Keto. GF + Vegan;keto;american;5.83;53.49;69.01;858.37
Keto Dinner rolls - egg and dairy free! (none of that fathead here);keto;american;61.44;25.9;50.74;806.02
Strawberry Oregano Turkey Burgers (Whole30. Paleo. Keto. Nut Free) recipes;keto;american;198.47;49.07;120.95;2078.71
Low Carb Chicken and Cheese Quesadillas {Gluten-free. Keto-friendly} recipes;keto;mexican;105.69;24.26;73.94;1185.26
Pork Curry over Cauliflower Rice | Low Carb | Keto | Gluten Free;keto;south east asian;105.75;38.83;45.28;985.84
Low Carb Chocolate Peanut Butter Cups {Gluten Free. Keto-Friendly} recipes;keto;american;25.59;44.3;268.92;2699.84
Aunt Rocky’s Chorizo and Spaghetti Squash Casserole (Low Carb. Keto);keto;italian;126.73;77.95;197.8;2598.92
Keto Chicken Pad Thai - Low Carb Stir Fried Noodles Recipe;keto;south east asian;161.6;409.17;151.65;3647.93
Easy Tomato Feta Soup Recipe - Low Calorie. Low Carb. Keto;keto;mediterranean;28.7;68.45;82.08;1127.32
4 Ingredient Mushroom Soup Recipe – Dairy Free + Low Carb + Keto Diet recipes;keto;american;16.16;21.95;93.82;996.82
Baked Low Carb Zucchini Fries (Paleo. AIP. Keto. Dairy Free);keto;french;25.33;57.48;97.11;1205.23
Keto Asian Meatballs Recipe with Dipping Sauce [Paleo. Dairy-Free];keto;italian;93.72;34.87;119.12;1586.44
Low Carb Vegan Ranch Dressing (dairy free. soy-free. keto) recipes;keto;american;37.85;41.23;80.91;1044.51
Keto Lamb Shanks Recipe Pressure Cooker [or Slow] - Falls Off The Bone;keto;middle eastern;221.08;32.92;208.59;2893.31
Aunt Rocky’s Keto Hot Cocoa Mix (Sugar Free. Dairy Free. Low Carb);keto;american;37.91;165.84;34.48;1125.32
The Best Keto Pizza - Gluten-Free. Low Carb and Protein-Packed! recipes;keto;italian;139.68;44.42;177.88;2337.32
Vietnamese Pho-Inspired Tomato Beef Soup (Paleo. Whole30. Keto) recipes;keto;south east asian;100.9;39.23;73.2;1219.32
Low Carb Beef and Cheddar Cauliflower Bake. THM S meal. Keto too;keto;british;710.81;112.56;1154.61;13684.97
Vegan Keto Buffalo Jackfruit Dip (soy-free. dairy-free. coconut-free);keto;american;26.97;171.28;102.15;1712.35
Easy keto and Low Carb Chicken Broccoli Casserole (Paleo and Gluten Free);keto;italian;137.72;43.49;113.95;1750.39
Creamy Chicken Alfredo Zoodles with Mushrooms – Low Carb Keto Ease! recipes;keto;french;42.13;22.91;59.02;791.34
Keto-Friendly Watergate Salad (aka Pistachio Cheesecake Mousse with Pineapple and Cherries);keto;american;17.99;47.38;120.16;1342.92
No Bake Pumpkin Keto Cheesecake Bars (Low Carb. Sugar Free. Gluten Free);keto;american;35.57;37.07;168.33;1805.53
Large Family Keto Instant Pot Beef Stew (Low Carb/THM S);keto;french;268.97;68.02;57.98;1869.78
Sara Louise's Keto Salmon Burgers With Homemade Thai Sweet Chilli Sauce;keto;south east asian;237.19;43.08;207.35;2987.23
Pumpkin in Browned Butter – aka Refried Pumpkin | Keto Allergy KISS Day 2 recipes;keto;american;10.58;24.24;40.3;501.98
Low Carb Blueberry Cheesecake Ice Cream (Keto. Sugar Free. Gluten Free);keto;american;20.32;21.36;115.31;1204.51
Kung Pao Cauliflower Chicken - Low Carb. Keto. Paleo and Gluten-Free! recipes;keto;eastern europe;264.42;103.62;53.3;1951.86
Wedge Salad with Homemade Blue Cheese Dressing - Low Carb. Keto. GF recipes;keto;american;79.65;51.24;369.24;3846.72
Low Carb Taco Soup for the Instant Pot or Slow Cooker. Keto. THM too;keto;french;581.42;102.78;677.8;8837
Never Fail Hollandaise – Low Carb Keto | Gluten Free | Egg Fast Magic recipes;keto;french;7.63;4.35;114.38;1077.34
Peanut Butter Chocolate Chip Mason Jar Ice Cream (Keto. L/C. S/F);keto;american;13.33;58.46;111.04;1286.52
This super-greens keto omelette with prawn and avocado is your new weeknight saviour;keto;japanese;77.64;90.8;154.27;2062.19
Healthy Homemade Keto Ice Cream in a Jar | Low Carb. Trim Healthy Mama S. too;keto;american;18.98;51.67;194.03;2028.87
Paleo Chocolate Mousse Cake (dairy Free. Raw Dessert. Keto. Paleo. Gluten Free) recipes;keto;american;48.81;278.15;264.65;3689.69
Dinners don't get easier than this maple-glazed keto salmon and greens recipe;keto;american;111.38;79.04;86.58;1540.9
Pork rind tortillas: A keto-friendly recipe that replicates our go-to shells for tacos. fajitas and more;keto;mexican;56.65;1.08;61.73;786.49
No-Beans Hummus from The Keto Diet (reprinted with permission. ©Leanne Vogel. Victory. 2017) recipes;keto;mediterranean;23.05;49.3;119.18;1362.02
Egg Fast Recipe – Tex Mex White Egg Pizza a Low Carb Keto Pizza Bonanza! recipes;keto;italian;25.66;8.52;60.58;681.94
Thai Coconut Red Curry Chicken Thighs with Bok Choy - Paleo. Gluten-Free. Keto. Low Carb recipes;keto;south east asian;280.52;59.34;454.58;5450.66
Fried cabbage and sausage;keto;middle eastern;29.91;60.68;98.6;1249.76
"Low Carb ""Breading""";keto;american;57.11;6.27;40.34;616.58
Banana chia pudding;keto;british;8.59;22.53;55.6;624.88
Aunt Rocky’s Spam Scramble;keto;american;64.52;11.65;77.07;998.31
Orange cream jello cups;keto;mediterranean;6.45;23.85;44.03;517.47
Aunt Rocky’s Garlic Butter Shrimp with Asparagus;keto;french;50.72;12.14;70.62;887.02
Egg and mozzarella pizza crust (1/2 pie);keto;italian;137.39;14.28;147.09;1930.49
Aunt Rocky’s Chicken & Avocado Wraps Filling;keto;american;12.29;6.47;38.41;420.73
Orange Dream;keto;british;16.27;90.19;133.44;1626.8
Adam's Vanilla Chia Pudding;keto;british;19.78;51.14;76.19;969.39
Aunt Rocky’s Quick Protein Eggnog (Sugar Free. Low Carb);keto;world;7.09;40.72;16.1;336.14
Sausage and Cheese Balls;keto;american;217.14;13.59;335.53;3942.69
Macadamia Crusted Mahi Mahi;keto;mediterranean;80.72;9.01;59.89;897.93
Fully loaded pan fried radishes;keto;british;25.59;8.78;25.2;364.28
Fathead pizza crust;keto;italian;83.43;479.9;34.44;2563.28
Tuscan Pork Tenderloin;keto;italian;375.92;8.09;64.63;2117.71
Aunt Rocky’s Almond Butter Fat Bomb;keto;american;26.23;64.01;110.21;1352.85
Aunt Rocky’s Sausage & Cheddar Biscuit Snacks (Gluten-Free. Low Carb);keto;american;142.12;37.8;245.26;2927.02
Aunt Rocky’s Spaghetti Squash Carbonara;keto;italian;107.46;42.39;203.11;2427.39
Chocolate mug cake;keto;british;9.72;12.63;19.06;260.94
Chicken appetizer;keto;british;167.65;124.1;306.51;3925.59
Beef Crust for Pizza;keto;italian;75.92;4.27;121.14;1411.02
Strawberry chocolate chip cheesecake;keto;american;22.66;70.33;197.06;2145.5
Spinach feta fritatta;keto;mediterranean;21.91;3.42;33.67;404.35
Bacon Wrapped Meatloaf;keto;american;232.88;6.28;215.88;2899.56
Chocolate Almond Coconut Fat Bombs;keto;french;24.61;45.84;351.68;3446.92
Stuffed Pork Chops;keto;american;188.32;5.75;133.89;1981.29
Mascarpone Mousse;keto;american;18.61;20.85;166.17;1653.37
Mushroom Base;keto;french;19.67;32.14;132.2;1397.04
Aunt Rocky’s Colored Sprinkles (Sugar Free);keto;american;0;12;0;48
Ham and egg salad;keto;american;70.04;10.85;128.41;1479.25
Succulent Sous Vide Chicken Thighs;keto;american;255.23;4.89;275.25;3517.73
Cream of Mushrooms;keto;american;10.45;20.25;75.25;800.05
Macadamia Fat Bread;keto;french;53.77;79.92;266.07;2929.39
Beef. cream cheese & shredded cheese;keto;american;169.13;7.26;239.23;2858.63
No Carb (No Cauliflower) Pizza Crust;keto;italian;225.2;10.55;94.58;1794.22
Indian Coconut Curry Salmon;keto;nordic;62.59;39.71;65.81;1001.49
Eggnog;keto;french;11.78;30.36;140.04;1428.92
Strawberry chocolate chip cheesecake;keto;american;22.66;70.33;197.06;2145.5
Spinach feta fritatta;keto;mediterranean;21.91;3.42;33.67;404.35
Bacon Wrapped Meatloaf;keto;american;232.88;6.28;215.88;2899.56
Chocolate Almond Coconut Fat Bombs;keto;french;24.61;45.84;351.68;3446.92
Stuffed Pork Chops;keto;american;188.32;5.75;133.89;1981.29
Mascarpone Mousse;keto;american;18.61;20.85;166.17;1653.37
Mushroom Base;keto;french;19.67;32.14;132.2;1397.04
Aunt Rocky’s Colored Sprinkles (Sugar Free);keto;american;0;12;0;48
Ham and egg salad;keto;american;70.04;10.85;128.41;1479.25
Succulent Sous Vide Chicken Thighs;keto;american;255.23;4.89;275.25;3517.73
Cream of Mushrooms;keto;american;10.45;20.25;75.25;800.05
Macadamia Fat Bread;keto;french;53.77;79.92;266.07;2929.39
Beef. cream cheese & shredded cheese;keto;american;169.13;7.26;239.23;2858.63
No Carb (No Cauliflower) Pizza Crust;keto;italian;225.2;10.55;94.58;1794.22
Indian Coconut Curry Salmon;keto;nordic;62.59;39.71;65.81;1001.49
Eggnog;keto;french;11.78;30.36;140.04;1428.92
Mediterranean Cucumber Tonic;mediterranean;mediterranean;0.25;12.01;0.33;52.01
Loup de Mer (Mediterranean Seabass);mediterranean;mediterranean;306.14;43.1;26.55;1635.91
Mediterranean Baked Trout with Olives. Fennel & Tomatoes recipes;mediterranean;mediterranean;187.14;42.31;87.94;1709.26
Mediterranean Salmon Risotto recipes;mediterranean;nordic;395.5;287.1;291.04;5349.76
Mediterranean Pita Melts;mediterranean;mediterranean;46.57;139.71;37.7;1084.42
Mediterranean Salmon Stuffed Shells;mediterranean;nordic;333.01;414.66;230.05;5061.13
Easy Stuffed Peppers;mediterranean;italian;76.64;429.13;58.98;2553.9
Mediterranean Spiced Cucumber Medallions;mediterranean;mediterranean;29.67;23.24;28.44;467.6
Marinated Mediterranean Olives;mediterranean;mediterranean;4.76;34.08;50.12;606.44
Loup De Mer (Mediterranean Seabass);mediterranean;mediterranean;306.68;45.78;26.54;1648.7
Mediterranean Chicken;mediterranean;mediterranean;281.25;78.76;167.28;2945.56
Grilled Tofu with a Mediterranean Chopped Salad;mediterranean;asian;33.62;16.2;30.37;472.61
Mediterranean Rub;mediterranean;mediterranean;1.09;4.56;0.18;24.22
Mediterranean Chicken Lettuce Wrap Tacos recipes;mediterranean;mediterranean;96.62;37.84;74.64;1209.6
Mediterranean Lasagna;mediterranean;italian;218.34;271.22;268.81;4377.53
Mediterranean Olive Hummus;mediterranean;mediterranean;25.97;78.69;57.46;935.78
Mediterranean Chicken;mediterranean;mediterranean;99.66;116.78;118.14;1929.02
Flatbread Pizza With Prosciutto & Gorgonzola;mediterranean;italian;216.49;528.48;215.02;4915.06
Mediterranean Mix;mediterranean;mediterranean;8.11;9.59;14.64;202.56
Mediterranean Wrap;mediterranean;mediterranean;135.85;31.94;40.02;1031.34
Mediterranean Marinade;mediterranean;mediterranean;1.5;12.79;68.75;675.91
Mediterranean Wrap;mediterranean;mediterranean;14.19;36.47;40.3;565.34
Mediterranean Spatchcock Chicken;mediterranean;mediterranean;159.58;10.45;168.86;2199.86
Crab. Scallion And Tomato Quiche;mediterranean;french;108.21;136.89;138.56;2227.44
Mediterranean Chicken;mediterranean;mediterranean;156.48;26.53;88.33;1527.01
Mediterranean Appetizer Board;mediterranean;mediterranean;88.77;305.3;112.14;2585.54
Mediterranean Chicken;mediterranean;mediterranean;327.56;57.06;146.5;2856.98
Homemade Labneh;mediterranean;mexican;25.18;12.46;59.23;683.63
Mediterranean Slices;mediterranean;mediterranean;64.35;201.3;192.7;2796.9
Tapenade;mediterranean;mediterranean;8.08;22.69;56.26;629.42
Mediterranean Marinade;mediterranean;mediterranean;1.5;12.79;68.75;675.91
Mediterranean Tuna;mediterranean;mediterranean;69.04;28.09;42.29;769.13
Mediterranean Couscous;mediterranean;mediterranean;47.95;284.92;8.88;1411.4
Mediterranean Pasta;mediterranean;mediterranean;77.45;363.81;112.54;2777.9
Mediterranean Pizza;mediterranean;italian;62.07;192.5;41.81;1394.57
Mediterranean Pizza;mediterranean;italian;64.24;213.66;49.41;1556.29
Mediterranean Herb Rub;mediterranean;mediterranean;1.69;5.68;14.25;157.73
Herby Mediterranean Fish with Wilted Greens & Mushrooms;mediterranean;mediterranean;68.27;41.25;50.83;895.55
Mediterranean Guacamole;mediterranean;mediterranean;10.34;47.1;66.56;828.8
Mediterranean Crostini;mediterranean;mediterranean;44.88;166.3;100.32;1747.6
Mediterranean scones;mediterranean;mediterranean;68.48;300.62;96.8;2347.6
Mediterranean Guacamole;mediterranean;mediterranean;18.05;80.87;119.28;1469.2
Mediterranean Brisket;mediterranean;mediterranean;206.85;29.03;258.03;3265.79
Mediterranean Succotash;mediterranean;american;55.63;217.06;33.77;1394.69
Mediterranean Pizza;mediterranean;italian;74.32;394.77;69.24;2499.52
Mediterranean Tuna Melt;mediterranean;mediterranean;140.01;68.39;108.71;1811.99
Mediterranean Chicken;mediterranean;mediterranean;345.61;150.24;392.03;5511.67
Mediterranean Chicken;mediterranean;mediterranean;119.31;240.48;89.59;2245.47
Mediterranean Ratatouille;mediterranean;french;28.88;150.49;59.84;1256.04
Mediterranean Bruschetta;mediterranean;mediterranean;90.59;253.26;127.67;2524.43
Chicken Souvlaki Kebabs with Mediterranean Couscous;mediterranean;mediterranean;132.49;123.37;61.32;1575.32
Mediterranean Chicken;mediterranean;mediterranean;197.86;48.16;84.59;1745.39
Easy Mediterranean Spice;mediterranean;mediterranean;0.74;3.93;0.16;20.12
Mediterranean Cod;mediterranean;mediterranean;88.36;39.99;25.91;746.59
Mediterranean Potato Salad;mediterranean;mediterranean;35.22;172.83;72.64;1485.96
Mediterranean Bruschetta;mediterranean;mediterranean;100.86;254;124.95;2543.99
Mediterranean Risotto;mediterranean;italian;83.82;325.59;120.42;2721.42
Mediterranean Marinade;mediterranean;mediterranean;4.06;22.62;163.26;1576.06
Middle Eastern Salad Bowls with Farro & Chicken;mediterranean;italian;131.92;106.72;28.87;1214.39
Mediterranean Flounder;mediterranean;mediterranean;72.24;32.18;21.62;612.26
Mediterranean Toast;mediterranean;mediterranean;9.99;21.92;8.78;206.66
Mediterranean Chicken;mediterranean;mediterranean;206.03;90.4;74.48;1856.04
Mediterranean Salad;mediterranean;mediterranean;86.43;430.82;121.02;3158.18
Mediterranean Salad;mediterranean;mediterranean;46.13;82.86;166.28;2012.48
Mediterranean Veggie Sandwiches;mediterranean;mediterranean;39.85;109.52;42.36;978.72
Mediterranean Chicken;mediterranean;mediterranean;94.96;46.31;85.96;1338.72
Mediterranean Eggs;mediterranean;mediterranean;72.83;50.7;62.3;1054.82
Mediterranean Focaccia;mediterranean;italian;112.38;549.98;90.39;3462.95
Mediterranean Pizza;mediterranean;italian;274.45;491.11;321.61;5956.73
Mediterranean Brisket;mediterranean;mediterranean;256.51;70.19;312.08;4115.52
Mediterranean Shrimp;mediterranean;mediterranean;162.9;260.05;110.64;2687.56
Mediterranean Tabbouleh;mediterranean;middle eastern;27.05;120.15;46.85;1010.45
Orecchiette with Mixed Greens and Goat Cheese;mediterranean;italian;24.37;84.92;9.07;518.79
Mediterranean Burgers;mediterranean;nordic;60.55;277.05;57.72;1869.88
Mediterranean Herb Mix;mediterranean;mediterranean;1.89;13.86;2.01;81.09
Mediterranean Pork Chops;mediterranean;mediterranean;93.07;3.7;59.04;918.44
Chopped Mediterranean Salad;mediterranean;mediterranean;7.71;12.57;12.37;192.45
Mediterranean-Stuffed Chicken;mediterranean;mediterranean;251.23;12.72;54.64;1547.56
Mediterranean Bento Lunch;mediterranean;mediterranean;39.83;92.83;19.93;710.01
Mediterranean Picnic Snack;mediterranean;mediterranean;7.17;20.8;5.87;164.71
Mediterranean Omelet recipes;mediterranean;mediterranean;17.88;6.39;21.62;291.66
Mediterranean Fish Fillets;mediterranean;mediterranean;45.03;18.04;8.17;325.81
Mediterranean Orzo Salad;mediterranean;mediterranean;52.08;191.86;79.51;1691.35
Grilled Mediterranean Snapper;mediterranean;mediterranean;145.7;35.22;41.89;1100.69
Mediterranean Salmon Skewers;mediterranean;nordic;94.73;17.42;69.99;1078.51
Mediterranean Herb Rub;mediterranean;mediterranean;6.62;24.47;7.57;192.49
Mediterranean Zucchini Hash;mediterranean;mediterranean;14.73;76.43;12.57;477.77
Mediterranean Pressed Sandwich;mediterranean;italian;119.01;180.49;96.61;2067.49
Mediterranean Lentil Salad;mediterranean;mediterranean;81.66;138.32;99.65;1776.77
Mediterranean Pasta Salad;mediterranean;mediterranean;31.63;47.39;23.33;526.05
Mediterranean Chicken recipes;mediterranean;mediterranean;146.34;20.28;109.94;1655.94
Mediterranean Creamsicle Floats;mediterranean;american;9.24;189.03;29.04;1054.44
Mediterranean Rice Noodles;mediterranean;asian;33.97;395.16;41.01;2085.61
Mediterranean Pasta Salad;mediterranean;mediterranean;27.21;140.11;44.56;1070.32
MEDITERRANEAN CORN SALAD;mediterranean;mediterranean;136.26;391.03;123.88;3224.08
Mediterranean Baked Cod;mediterranean;mediterranean;167.34;14.3;6.9;788.66
Mediterranean Crunch Salad;mediterranean;mediterranean;37.09;129.25;13.45;786.41
Mediterranean Quinoa Bowl;mediterranean;mediterranean;65.37;233.41;74.62;1866.7
Mediterranean prawn salad;mediterranean;mediterranean;32.23;36.16;56.83;785.03
Mediterranean Vegetable Hash;mediterranean;mediterranean;14.73;76.5;1.77;380.85
Speedy Mediterranean gnocchi;mediterranean;mediterranean;26.53;151.27;14.91;845.39
Mediterranean Grain Salad;mediterranean;mediterranean;14.02;48.13;16.24;394.76
Mediterranean Beef Pitas;mediterranean;mediterranean;111.97;137.91;140.62;2265.1
Mediterranean Cauliflower Pizza;mediterranean;italian;83.4;75.67;97.28;1511.8
Mediterranean Grain Salad;mediterranean;mediterranean;14.02;48.13;16.24;394.76
Mediterranean sardine salad;mediterranean;mediterranean;51.52;5.77;40.72;595.64
Mediterranean stuffed peppers;mediterranean;mediterranean;23.98;86.02;30.6;715.4
Mediterranean Slaw Dogs;mediterranean;mediterranean;13.54;16.4;72.72;774.24
Mediterranean Mackerel Salad;mediterranean;mediterranean;57.9;10.27;59.68;809.8
Mediterranean Lamb Chops;mediterranean;mediterranean;134.07;41.94;245.28;2911.56
Mediterranean Tuna Salad;mediterranean;mediterranean;70.36;23.76;19.48;551.8
Mediterranean Fish Parcels;mediterranean;mediterranean;69.49;52.45;11.42;590.54
Mediterranean Fish Stew;mediterranean;mediterranean;115.25;167.93;32.56;1425.76
Mediterranean Shrimp Caesar;mediterranean;mediterranean;9.52;6.4;82.52;806.36
Mediterranean potato salad;mediterranean;mediterranean;33.04;183.28;22.2;1065.08
Mediterranean Tuna Wrap;mediterranean;mediterranean;115.43;130.82;40.33;1347.97
Mediterranean Quesadillas recipes;mediterranean;mexican;35.9;36.23;36.47;616.75
Mediterranean Tuna Sandwiches;mediterranean;mediterranean;45.57;66.57;20.23;630.63
Mediterranean Marinated Vegetables;mediterranean;mediterranean;34.59;147.52;142.69;2012.65
Mediterranean Tuna Salad;mediterranean;mediterranean;164.46;115.51;125.52;2249.56
Mediterranean potato salad;mediterranean;mediterranean;9.92;75.91;17.29;498.93
